{"bm25":{"k1":1.2},"compiler_version":"0.10.0","conflicts":{"authority_role_penalty":0.03,"explicit_superseded_penalty":0.25},"coverage_floor":0.45,"features":{"authority_strength":{"normative":1,"observed":0.75,"user-confirmed":0.95},"confidence_weights":{"approximate":{"approximate_anchor":0.85,"channel_diversity":0.05,"field_coverage":0.1},"concept":{"field_coverage":0.15,"high_signal_concepts":0.55,"high_signal_terms":0.2,"query_coverage":0.1},"density":{"field_coverage":0.1,"matched_terms":0.55,"query_coverage":0.35},"embedding":{"embedding_similarity":1}},"evidence_strength":{"authority_doc":0.25,"code_path":0.2,"code_symbol":0.2,"code_test":0.25,"l2_hook":0.1},"exact_kind_strength":{"basename":0.88,"doc-id":0.82,"error":1,"name":0.9,"path":1,"symbol":1,"symbol-suffix":0.9,"test":0.92,"test-case":0.96,"trigger":0.72},"freshness_half_life_days":365,"graph_kind_strength":{"authority-doc":0.85,"code-evidence":0.8,"code-test":0.8,"history-doc":0.7,"l2-hook":0.55,"supersedes":0.95,"wiki-link":1},"rrf_weight":1,"weights":{"anchor_terms":0.15,"approximate_anchor":0,"authority":0.01,"channel_diversity":0.05,"embedding_similarity":0,"evidence":0.01,"exact_anchor":0.15,"field_coverage":0.2,"freshness":0.01,"graph_quality":0.02,"high_signal_concepts":0.3,"high_signal_terms":0.15,"matched_terms":0.15,"query_coverage":0.2,"query_span_coverage":0,"scope_overlap":0.01}},"field_weights":{"authorityDocs":{"exact_boost":12,"length_normalization":0.2,"weight":1.8},"body":{"exact_boost":7,"length_normalization":0.75,"weight":1},"codePath":{"exact_boost":32,"length_normalization":0.1,"weight":4.8},"codeSymbol":{"exact_boost":34,"length_normalization":0.1,"weight":5.2},"codeTest":{"exact_boost":24,"length_normalization":0.1,"weight":3.4},"description":{"exact_boost":15,"length_normalization":0.35,"weight":2.5},"hooks":{"exact_boost":16,"length_normalization":0.25,"weight":2.8},"name":{"exact_boost":22,"length_normalization":0,"weight":3.5},"scopes":{"exact_boost":2,"length_normalization":0,"weight":0.4},"triggers":{"exact_boost":25,"length_normalization":0.1,"weight":3.4}},"mmr":{"default_limit":10,"lambda":0.78,"maximum_limit":50,"similarity_threshold":0.82},"profile":"deterministic-ranker-v1","quality_source":{"path":"scripts/memory-public-assets/.ownmem/quality.lock.json","sha256":null},"rrf":{"channel_weights":{"bm25f":16,"embedding":0,"exact":8,"fuzzy":0.25,"graph":0.05,"ngram":0.1},"k":10},"schema":"ownmem-index.ranking/v4","thresholds":{"decision":0.65,"error":0.7,"identifier":0.6,"mixed":0.65,"natural":0.65,"path":0.7},"tokenizer_profile":"adaptive-script-v2","trust":{"max_staleness_days":730}}
